QuestionID,Question,Answer
1,Can you tell me about yourself?,"I am a motivated individual with a background in [your field], currently in my third year of studies. I have experience in [relevant experience] and am passionate about leveraging my skills in challenging environments.
2,Why do you want to work at our company?,I admire your company's innovative approach and commitment to [company's mission/values]. I believe my skills align well with your needs and I am excited about contributing to your team's success.
3,What are your greatest strengths and weaknesses?,My greatest strength is my ability to adapt and learn quickly. A weakness I am working on is delegating tasks, as I tend to take on too much responsibility myself.
4,Where do you see yourself in five years?,In five years, I see myself growing in my career, taking on leadership roles, and making significant contributions to projects that align with my skills and interests.
5,Why should we hire you over other candidates?,I bring a unique combination of skills, dedication, and a continuous desire to learn, which will help me make meaningful contributions to your team.
6,Can you describe a challenging situation you faced and how you resolved it?,I faced a project deadline that seemed impossible to meet. By reorganizing the team’s tasks and focusing on priorities, we managed to deliver on time.
7,What motivates you to perform well at work?,I am motivated by achieving goals, learning new skills, and seeing the positive impact of my work on the team and company.
8,How do you handle criticism or feedback from your manager?,I view feedback as an opportunity to grow. I listen carefully, reflect on it, and take actionable steps to improve.
9,Can you share an example of how you worked effectively in a team?,I worked on a group project where we divided tasks based on each member’s strengths, leading to a successful outcome and positive feedback.
10,What is your approach to time management and meeting deadlines?,I prioritize tasks, set clear goals, and use tools like calendars and task lists to stay on track.
11,How do you manage stress in the workplace?,I manage stress by breaking tasks into smaller steps, taking short breaks, and practicing mindfulness techniques.
12,What do you know about our company's values and culture?,Your company values innovation, teamwork, and customer satisfaction, which aligns with my own values.
13,Can you give an example of a conflict you resolved at work?,I mediated a disagreement between team members by facilitating open communication, leading to a better understanding and collaboration.
14,How do you prioritize your tasks when everything seems urgent?,I assess the impact and urgency of each task, focusing on those with the highest priority first.
15,What are your salary expectations?,I am open to discussing a fair compensation package that reflects my skills and the role’s responsibilities.
16,Are you comfortable working in a fast-paced environment?,Yes, I thrive in fast-paced environments and enjoy the challenge of managing multiple priorities.
17,How do you ensure continuous learning and skill development?,I take online courses, attend workshops, and stay updated with industry trends to keep my skills relevant.
18,What is your preferred work style: independently or collaboratively?,I enjoy both working independently and collaborating with teams, depending on the project’s needs.
19,Do you have any questions for us about the role or company?,Can you tell me more about the team I would be working with and the expectations for this role?
20,What makes you the ideal candidate for this position?,My skills, experience, and passion for continuous learning make me a strong fit for this role.
