Question,Answer1,Answer2,Answer3
"Tell me about yourself?","I am a dedicated software developer with 5 years of experience in Python and web development. I enjoy solving complex problems and creating efficient solutions.","I have a background in marketing, with a strong focus on digital strategies and data analysis. I am passionate about leveraging data to drive business growth.","I am a recent graduate with a degree in computer science, eager to start my career in software engineering and learn as much as possible from experienced professionals."
"Why does this role attract you?","This role aligns perfectly with my skills in web development, and I am excited about the opportunity to work on large-scale projects.","I am attracted to this role because it offers the chance to work with cutting-edge technologies and contribute to innovative projects.","The company's focus on continuous learning and development is what really drew me to this role, as I am always looking to expand my knowledge and skills."
"Would you like to work overtime or odd hours?","I am open to working overtime or odd hours if the project demands it, as I understand that deadlines can sometimes require extra effort.","While I prefer to maintain a work-life balance, I am willing to work overtime when necessary to ensure project success.","I am flexible with my working hours and can adapt to overtime or odd hours when it is needed for the team or project."
"What is more important to you: the money or the work?","While fair compensation is important, I believe the quality of work and job satisfaction are more crucial for long-term success and happiness.","I prioritize meaningful work that challenges me and allows me to grow professionally over financial gain.","Both are important, but I find that when I am engaged and passionate about my work, the financial rewards follow naturally."
"What do you know about this organization?","I know that this organization is a leader in the tech industry, known for its innovation and commitment to employee development.","Your company has a strong reputation for delivering high-quality products and maintaining a positive workplace culture.","I have researched your organization and am impressed by your dedication to sustainability and social responsibility in addition to your business success."
"Why did you leave your last job?","I left my last job because I was seeking new challenges and opportunities for growth that were not available in my previous position.","I decided to leave my last job to pursue a role that better aligns with my career goals and interests in the tech industry.","My last position was a great learning experience, but I felt it was time to move on to a role where I could apply my skills more effectively and take on new challenges."
"Why should we hire you?","You should hire me because I bring a unique blend of technical expertise and creative problem-solving skills that will contribute to the success of your projects.","I am a highly motivated and dedicated professional who is eager to contribute to your team and help achieve your company's goals.","My experience, coupled with my passion for continuous learning, makes me a strong candidate who can bring fresh ideas and a strong work ethic to your organization."
"What are your salary expectations?","I am looking for a competitive salary that reflects my skills and experience, but I am open to discussion based on the overall compensation package.","My salary expectations are in line with industry standards for this role, but I am flexible and willing to negotiate.","I expect a salary that is commensurate with my experience and the responsibilities of the position, but I am more interested in the growth opportunities the role offers."
"Assume you are hired, then how long would you expect to work for us?","I am looking for a long-term position where I can grow with the company and contribute to its success over several years.","I hope to work with your organization for many years, as I am looking for a stable and fulfilling career.","My goal is to build a lasting career with your company, where I can continue to learn and take on new responsibilities over time."
"How would you rate yourself on a scale of 1 to 10?","I would rate myself an 8 out of 10 because I have strong skills and experience, but I also believe there is always room for improvement and growth.","I would give myself a 7 out of 10, as I have a solid foundation, but I am continuously learning and striving to be better.","I would rate myself a 9 out of 10, confident in my abilities but also aware that there's always more to learn and new challenges to tackle."
"What are your achievements in life?","One of my key achievements is leading a project that significantly improved my previous company's operational efficiency by 30%.","I successfully completed a marathon last year, which required months of dedication and training.","I was the top student in my university's computer science program, graduating with honors and receiving multiple awards for academic excellence."
"What is your objective in life?","My objective in life is to continually grow as a professional, contributing to meaningful projects that make a positive impact on the world.","I aim to achieve a balance between personal fulfillment and professional success, constantly learning and improving in all aspects of life.","My life objective is to leave a lasting legacy through innovative work and by mentoring others in my field."
"What are your strengths?","My strengths include strong analytical thinking, effective communication, and a dedication to continuous learning.","I am highly adaptable, able to learn quickly, and excel in collaborative environments.","I possess excellent problem-solving skills, a strong work ethic, and the ability to work under pressure."
"What are your weaknesses?","I sometimes struggle with delegating tasks because I like to ensure everything is done perfectly, but I am working on trusting my team more.","My perfectionism can sometimes slow me down, but I am learning to focus on efficiency as well.","I tend to take on too many responsibilities at once, but I am improving my time management skills to address this."
"What are your hobbies?","My hobbies include hiking, reading science fiction, and experimenting with new programming languages.","I enjoy painting, cycling, and volunteering at local community events.","In my free time, I like to play chess, practice yoga, and explore new technologies."
"Explain, how would you be an asset to this organization?","I would be an asset to your organization by bringing my technical expertise and innovative ideas to improve processes and drive success.","My experience in project management and team leadership will help ensure that your projects are completed on time and to a high standard.","I can contribute by applying my problem-solving skills to tackle complex challenges and by fostering a collaborative team environment."
"Would you lie for the company?","I believe in honesty and integrity, so I would not lie for the company, but I would always strive to find ethical solutions to any problem.","I think transparency is crucial, so while I would protect the company's interests, I would not lie or compromise my values.","I value honesty, and I believe that long-term success is built on trust, so I would not lie for the company."
"Are you applying for other jobs also?","Yes, I am exploring a few opportunities to find the best fit for my skills and career goals.","I have applied to a couple of other positions, but I am particularly interested in this role due to the unique opportunities it offers.","While I am considering other opportunities, this role is my top choice because it aligns closely with my career aspirations."
"How did you know about this position/ vacancy?","I came across this position on a job board and was immediately interested due to the alignment with my skills and career goals.","A colleague referred me to this vacancy, and after researching the company, I knew it was a great fit for me.","I found out about this vacancy through your company's LinkedIn page, and the job description caught my attention."
"What was the biggest mistake of your life?","One of my biggest mistakes was not taking a risk early in my career, but it ultimately led to greater fulfillment and success.","I regret not pursuing further education earlier, but I have since taken steps to continue learning and growing.","A significant mistake was missing out on an opportunity due to lack of preparation, but it taught me the importance of being proactive."
"How do you deal with an angry or irritated customer?","I listen to the customer’s concerns, empathize with their situation, and work to resolve the issue as quickly and effectively as possible.","I remain calm, apologize for any inconvenience, and offer a solution that addresses their concerns while maintaining a professional demeanor.","I focus on understanding the customer’s frustration, keeping communication open and clear, and finding a resolution that satisfies them."
"What is your greatest fear?","My greatest fear is not reaching my full potential and missing out on opportunities for growth and development.","I fear becoming complacent in my career, so I constantly challenge myself to learn and improve.","My biggest fear is failure, but I use it as motivation to push myself and achieve my goals."
"Explain the difference between group and team?","A group is a collection of individuals working independently, while a team works collaboratively towards a common goal.","In a group, members may not necessarily work together, but a team is united with a shared purpose and responsibilities.","A team is a cohesive unit where members support each other, whereas a group might simply be people with similar interests or tasks."
"What will you do if you don't get this position?","If I don't get this position, I will continue to seek opportunities that align with my career goals and use this experience as motivation to improve.","I will reflect on the feedback, work on my areas of improvement, and keep applying to roles that fit my skills and aspirations.","I would be disappointed, but I would use this experience to grow and continue pursuing my career path with determination."
"Would you like to relocate or travel for the company?","Yes, I am open to relocating or traveling for the company if it means contributing to important projects or advancing my career.","I am willing to relocate or travel for work, as I believe it offers valuable experiences and opportunities for growth.","I am flexible and would consider relocation or travel if it aligns with my professional goals and the company's needs."
"Is there anything which makes you different from other candidates?","My ability to combine technical skills with creative problem-solving sets me apart from other candidates.","I have a unique blend of experience in both customer service and technical fields, which allows me to approach problems from multiple perspectives.","My strong communication skills, coupled with my dedication to continuous learning, make me a standout candidate."
"Describe the three things that are most important for you in a job?","The three things most important to me in a job are growth opportunities, a positive work environment, and work-life balance.","I value a job where I can make a meaningful impact, have opportunities for professional development, and work with a supportive team.","The most important aspects for me are challenging work, a collaborative culture, and the ability to contribute to innovative projects."
"What are your expectations from the company?","I expect the company to provide a supportive environment where I can grow, learn, and contribute to meaningful projects.","My expectation is that the company values its employees, offers opportunities for professional development, and maintains a positive workplace culture.","I expect a company to recognize and reward hard work, encourage innovation, and foster a culture of collaboration and respect."
"On a scale of one to ten, rate me as an interviewer?","I would rate you a 9 out of 10 because the interview was thorough, and you made me feel comfortable while asking insightful questions.","I would give you an 8 out of 10, as the questions were challenging and relevant, but I would have appreciated more discussion on company culture.","I would rate you a 10 out of 10, as you were professional, engaged, and asked questions that allowed me to fully showcase my skills and experience."
"Who is your role model? What have you incorporated into your life from him/her?","My role model is Elon Musk, and I have incorporated his relentless pursuit of innovation and ability to think outside the box into my life.","My role model is my father, who taught me the value of hard work, integrity, and perseverance in all endeavors.","I look up to Marie Curie for her dedication to science and education, and I strive to approach my work with the same level of passion and curiosity."
"Do you have any questions for me?","Yes, I would like to know more about the company’s plans for growth and how the team I would be joining contributes to those goals.","Could you tell me more about the company culture and how it supports employee development and work-life balance?","What do you think are the most important qualities for someone to excel in this role, and how does the company support continuous learning?"
