question,answer
"Tell me about yourself.","I am a software developer with 5 years of experience in full-stack development. I have a strong background in JavaScript, Python, and cloud technologies. I am passionate about creating efficient, user-friendly applications and enjoy tackling complex problems. I’m a team player, detail-oriented, and always eager to learn new things."
"Walk me through your resume.","I graduated with a degree in Computer Science from XYZ University in 2018. My first role was as a Junior Developer at ABC Corp, where I focused on front-end development. After two years, I moved to DEF Ltd as a Full-Stack Developer, where I worked on several high-impact projects using React and Node.js. Currently, I am at GHI Inc., where I lead a small team of developers and manage end-to-end project delivery."
"What are your strengths and weaknesses?","My strengths include problem-solving, adaptability, and strong communication skills. I can quickly understand and analyze complex issues and find efficient solutions. As for my weakness, I sometimes get too focused on the details, which can slow me down, but I've been working on balancing this with a broader view."
"How would you describe yourself in three words?","Dedicated, collaborative, and innovative."
"What motivates you?","I am motivated by challenges and the opportunity to learn new skills. Seeing a project through from start to finish and making a tangible impact is what drives me."
"What are your hobbies and interests?","I enjoy hiking, reading science fiction, and working on personal coding projects. I also like to stay updated with the latest technology trends and advancements."
"Tell me about a time when you faced a challenge and how you overcame it.","In my previous job, we had a major project that was falling behind schedule. I took the initiative to reorganize the project timeline, reallocate resources, and improve communication within the team. As a result, we completed the project on time and exceeded the client’s expectations."
"Where do you see yourself in five years?","In five years, I see myself as a senior developer or team lead, contributing to major projects and driving technological innovation within the company. I hope to continue growing my skills and take on more leadership responsibilities."
"What are your long-term career goals?","My long-term career goals include becoming an expert in software development and taking on strategic roles where I can influence technology decisions and mentor junior developers. I also aspire to work on high-impact projects that make a difference."
"Why did you choose this career path?","I have always been fascinated by technology and problem-solving. Software development allows me to combine these interests and create solutions that have a real-world impact. The constant learning and innovation in this field keep me motivated."
"How do you plan to achieve your career goals?","I plan to achieve my career goals by continuously improving my technical skills, seeking out new challenges, and taking on leadership opportunities. I also intend to pursue additional certifications and engage in professional development activities."
"What do you look for in a job?","I look for a job that offers growth opportunities, challenges me to develop new skills, and aligns with my values. A collaborative and supportive work environment is also important to me."
"Why do you want to work for this company?","I am impressed by your company’s innovative approach and its commitment to [specific company values or projects]. I believe that my skills and experiences align well with the goals of your team, and I am excited about the opportunity to contribute to your success."
"What do you know about our company?","I know that your company is a leader in [industry/field] and is known for its innovative products and services. I am particularly interested in your recent [project/initiative] and the impact it has had on [specific area]."
"Why are you interested in this role?","I am interested in this role because it aligns perfectly with my background in [relevant skills or experiences]. The opportunity to work on [specific projects or tasks] and contribute to [company’s goals] excites me."
"What makes you a good fit for this position?","My background in [relevant skills or experiences] and my ability to [specific skills related to the job] make me a strong fit for this position. I have a proven track record of [relevant achievements], which I believe will help me contribute effectively to your team."
"How do you see yourself contributing to our company?","I see myself contributing to your company by leveraging my skills in [specific area] to drive [specific goals or projects]. I am also eager to collaborate with the team to bring innovative solutions and improve processes."
"What do you know about our industry?","I am aware that the [industry] is rapidly evolving with trends such as [specific trends]. Your company’s role in [industry] and its approach to [specific challenge or opportunity] demonstrate a forward-thinking attitude that I admire."
"How do you handle feedback and criticism?","I view feedback and criticism as opportunities for growth. I listen carefully, understand the points being made, and take actionable steps to improve. Constructive feedback helps me become better at my job and enhance my skills."
"Describe your ideal work environment.","My ideal work environment is one that fosters collaboration, creativity, and continuous learning. I value a culture that encourages open communication, recognizes achievements, and provides opportunities for professional development."
"Describe a time when you had to work with a difficult colleague.","In a previous role, I worked with a colleague who had a different communication style. I made an effort to understand their perspective, established clear expectations, and focused on finding common ground. By fostering open dialogue, we were able to collaborate effectively."
"How do you handle stress and pressure at work?","I handle stress and pressure by staying organized, prioritizing tasks, and maintaining a positive attitude. I also find that taking short breaks and practicing time management techniques help me stay focused and manage stress effectively."
"Can you give an example of a project where you demonstrated leadership?","I led a project to develop a new feature for our application. I coordinated the team, set clear objectives, and ensured that we met our deadlines. My leadership helped us deliver the project successfully, and we received positive feedback from stakeholders."
"How do you prioritize your tasks?","I prioritize tasks based on their urgency and importance. I use tools like task lists and project management software to keep track of deadlines and allocate time effectively. I also regularly reassess priorities to adapt to changing needs."
"Can you give an example of how you have handled unexpected challenges?","During a critical project phase, we faced a major technical issue that threatened our timeline. I quickly assembled the team to brainstorm solutions, identified a workaround, and communicated the plan to stakeholders. We successfully navigated the challenge and delivered the project on time."
"How do you work in a team?","I work in a team by collaborating openly, sharing ideas, and supporting my colleagues. I believe in building strong relationships and ensuring that everyone’s input is valued. I also focus on clear communication and aligning team efforts toward common goals."
"Describe a time when you had to work with a team to achieve a goal.","In a recent project, our team was tasked with developing a new feature under a tight deadline. We divided the work based on each team member’s strengths, held regular check-ins, and collaborated closely to ensure progress. Our combined efforts led to the successful launch of the feature on schedule."
"How do you handle conflicts within a team?","I address conflicts within a team by first listening to all perspectives and understanding the root cause of the issue. I facilitate open discussions to find common ground and work towards a resolution that is acceptable to all parties. Effective communication and empathy are key."
"What role do you typically take in a team setting?","I typically take on a collaborative role, contributing ideas and working with others to achieve our objectives. I am also comfortable taking on leadership responsibilities when needed, guiding the team towards our goals and ensuring effective execution."
"How do you ensure effective communication within a team?","I ensure effective communication by being clear and concise in my messages, actively listening to others, and encouraging open dialogue. I also use communication tools and regular meetings to keep everyone informed and aligned."
"How do you handle change in the workplace?","I handle change by staying flexible and adapting quickly. I approach change with a positive attitude, seeking to understand the reasons behind it and how it affects my role. I also take proactive steps to adjust and support others through the transition."
"Describe a situation where you had to adapt to a new environment or role.","When I joined my previous company, I had to adapt to a new team culture and different project management methodologies. I took the time to learn the new processes, engaged with my colleagues to understand their expectations, and adjusted my approach to fit the new environment."
"How do you manage multiple projects or tasks at once?","I manage multiple projects by prioritizing tasks, setting clear goals, and using project management tools to track progress. I also break down larger projects into smaller tasks and delegate responsibilities when appropriate to ensure timely completion."
"Can you give an example of how you have handled unexpected challenges?","In a previous role, we experienced a sudden change in project requirements. I quickly assessed the impact, re-prioritized tasks, and communicated the changes to the team. By adjusting our approach and working together, we successfully delivered the project with the new requirements."
"What are your values, and how do they align with our company?","My values include integrity, collaboration, and continuous learning. I align with your company’s emphasis on innovation and teamwork, and I am committed to upholding ethical standards and contributing to a positive and productive work environment."
"What does 'success' mean to you?","Success to me means achieving goals and making a positive impact through my work. It involves personal growth, professional accomplishments, and contributing to the success of the team and organization."
"How do you ensure work-life balance?","I ensure work-life balance by setting clear boundaries between work and personal time, managing my schedule effectively, and making time for activities I enjoy. I believe that maintaining balance is important for long-term productivity and well-being."
"Describe your ideal company culture.","My ideal company culture is one that fosters collaboration, values diversity, and encourages professional growth. A supportive environment where employees feel valued and are given opportunities to contribute and innovate is important to me."
"What does diversity and inclusion mean to you?","Diversity and inclusion mean creating a workplace where individuals from different backgrounds feel respected and valued. It involves embracing varied perspectives, fostering a culture of equity, and ensuring that everyone has equal opportunities to contribute and succeed."
"How do you make important decisions?","I make important decisions by gathering relevant information, considering different perspectives, and evaluating the potential outcomes. I also seek input from others when appropriate and use a structured approach to weigh the pros and cons before making a decision."
"Can you give an example of a difficult decision you've made at work?","I had to make a difficult decision regarding resource allocation during a project. I carefully assessed the impact on project timelines and team members, consulted with stakeholders, and made a decision that balanced competing priorities while maintaining project quality."
"How do you approach solving complex problems?","I approach solving complex problems by breaking them down into smaller, manageable parts. I analyze each component, identify potential solutions, and evaluate their feasibility. Collaboration with others and iterative testing also help in finding effective solutions."
"Describe a time when you had to make a decision with limited information.","In a previous role, I had to make a decision about a product feature with limited data. I used my experience and consulted with the team to gather insights. I made an informed decision based on available information and adjusted as new data emerged."
"Tell me about a time you went above and beyond for a job.","I volunteered to lead a critical project that was falling behind schedule. I worked extra hours, coordinated with various teams, and implemented process improvements. My efforts helped us meet the deadline and deliver a successful outcome for the client."
"Give an example of a situation where you had to handle a difficult client.","I once worked with a client who was unhappy with the project’s progress. I scheduled a meeting to understand their concerns, addressed their feedback, and provided regular updates to rebuild trust. By addressing their issues and maintaining open communication, we were able to complete the project successfully."
"Describe a time when you failed at something and how you handled it.","I once missed a project deadline due to unforeseen challenges. I took responsibility for the delay, analyzed what went wrong, and implemented changes to prevent similar issues in the future. I also communicated transparently with the client and worked to deliver the project as quickly as possible."
"How do you deal with constructive criticism?","I deal with constructive criticism by listening carefully, asking for clarification if needed, and reflecting on the feedback. I use it as an opportunity to improve my skills and performance, and I appreciate the chance to learn and grow from others’ perspectives."
"What would you do if you witnessed unethical behavior at work?","If I witnessed unethical behavior, I would report it through the appropriate channels while ensuring confidentiality. I believe in upholding ethical standards and would take action to address the issue and support a positive and transparent work environment."
"How do you handle situations where your values are challenged?","I handle such situations by staying true to my values while seeking to understand differing perspectives. I engage in respectful dialogue to find common ground and address concerns, and I remain committed to maintaining integrity and professionalism."
"Describe a time when you had to stand up for what you believed in.","I once advocated for a change in a project’s direction that aligned better with ethical standards. I presented my case to the team and management, outlining the benefits of the change. My approach was well-received, and the change was implemented successfully."
"What are your salary expectations?","Based on my research and experience, I am looking for a salary range of $X to $Y. However, I am open to discussing this further based on the overall compensation package and opportunities for growth within the company."
"Are you willing to relocate?","Yes, I am open to relocation if it is necessary for the role and aligns with my career goals. I would consider the location, relocation support, and how it fits into my long-term plans."
"What is your availability to start the job?","I am available to start within [X] weeks after receiving an offer. This will allow me to complete any current obligations and ensure a smooth transition to the new role."
"Are you open to working overtime or on weekends?","Yes, I am open to working overtime or on weekends if the job requires it. I understand that meeting project deadlines and addressing urgent needs can sometimes involve extra hours, and I am willing to contribute as needed."
"Do you have any questions for us?","Yes, I do. Can you tell me more about the team I would be working with and the key challenges for this role? Additionally, what are the opportunities for professional development within the company?"
"Why should we hire you?","You should hire me because I bring a strong background in [relevant skills], a proven track record of [specific achievements], and a passion for contributing to [company’s goals]. I am confident that my skills and experiences make me a valuable asset to your team."
"Is there anything else you’d like to add?","I would like to add that I am genuinely excited about the opportunity to work with your company and contribute to your team. I am eager to bring my skills and enthusiasm to this role and help achieve your company’s objectives."
